{
  "count": 0,
  "verdict": "pass",
  "offenders": [],
  "checked": [
    "changes.json new_features has exactly 21 ids (counts.new=21); each has a dedicated '## <id>' section in update-manual.md.",
    "openapi.user.get (L32), user.upsert (L68), user.delete (L97), user.event.create (L126) each have 무엇/왜 + 어떻게(method+path+auth+params+example) + 개인정보 주의 filled.",
    "openapi.userchat.list (L158), userchat.get (L183), user.userchats.list (L208), user.userchats.create (L233), userchat.sessions.list (L258) each have full 무엇/왜 + 어떻게 content.",
    "openapi.message.list (L287), message.send (L325), group.message.send (L351) filled; manager.list (L381), manager.get (L409) filled with mask_inbound guidance.",
    "openapi.group.list (L441), bot.create (L470), bot.list (L496), channel.get (L525) each have full 무엇/왜 + 어떻게 sections.",
    "webhook.message.created (L558), webhook.userchat.opened (L595), webhook.user.created (L621) each have 무엇/왜 + 어떻게(event+HMAC auth+payload example) + inferred badge; no empty shells.",
    "No id is a bare listing without content; all 21 have real method/path/auth/example bodies. Missing count = 0."
  ],
  "fixes": []
}
